{
  "$schema": "https://json-schema.org/draft/2020-12/schema",
  "$id": "https://linea.build/schemas/getZkRollupAggregationProofV1.request.schema.json",
  "title": "getZkRollupAggregationProof V1 request",
  "description": "Coordinator -> prover rollup-aggregation proof request. The shared, versioned contract for the rollup-aggregation guest input (RollupAggregationProofPrivateInput): a {guestProgramId, provingSystem, proofRequest} envelope embedding the rollup proofs it recursively verifies.",
  "type": "object",
  "additionalProperties": false,
  "required": [
    "guestProgramId",
    "provingSystem",
    "proofRequest"
  ],
  "properties": {
    "guestProgramId": { "$ref": "#/$defs/hash32" },
    "provingSystem": { "type": "string", "minLength": 1 },
    "metadata": { "$ref": "#/$defs/metadata" },
    "proofRequest": {
      "type": "object",
      "additionalProperties": false,
      "required": ["rollupProofs"],
      "properties": {
        "rollupProofs": {
          "type": "array",
          "minItems": 1,
          "items": { "$ref": "#/$defs/rollupProof" }
        }
      }
    }
  },
  "$defs": {
    "uint": { "type": "integer", "minimum": 0 },
    "tailCount": { "type": "integer", "minimum": 0, "maximum": 130046 },
    "hex": { "type": "string", "pattern": "^0x([0-9a-fA-F]{2})*$" },
    "hash32": { "type": "string", "pattern": "^0x[0-9a-fA-F]{64}$" },
    "address": { "type": "string", "pattern": "^0x[0-9a-fA-F]{40}$" },
    "metadata": {
      "description": "Non-contractual, debug/ops-only fields. NOT consumed by the guest",
      "type": "object",
      "additionalProperties": false,
      "properties": {
        "startBlockNumber": { "$ref": "#/$defs/uint" },
        "endBlockNumber": { "$ref": "#/$defs/uint" },
        "startBlockTimestamp": { "$ref": "#/$defs/uint" },
        "endBlockTimestamp": { "$ref": "#/$defs/uint" },
        "transactionsCount": { "$ref": "#/$defs/uint" },
        "totalGasUsed": { "$ref": "#/$defs/uint" }
      }
    },
    "rollupPublicInputs": {
      "type": "object",
      "additionalProperties": false,
      "required": [
        "endBlockNumber",
        "endBlockTimestamp",
        "endL1L2BridgeRollingHash",
        "endL1L2BridgeRollingHashMessageNumber",
        "dynamicChainConfigHash",
        "parentFtxRollingHash",
        "parentFtxNumber",
        "endFtxRollingHash",
        "endProcessedFtxNumber",
        "parentDataRollingHash",
        "endDataRollingHash",
        "parentBlockHash",
        "endBlockHash",
        "parentDataTailTakeBytes",
        "finalDataTailDiscardBytes",
        "l2L1Messages",
        "filteredAddresses",
        "programVks",
        "blockCount",
        "l2MessagingBlocksOffsets"
      ],
      "properties": {
        "endBlockNumber": { "$ref": "#/$defs/uint" },
        "endBlockTimestamp": { "$ref": "#/$defs/uint" },
        "endL1L2BridgeRollingHash": { "$ref": "#/$defs/hash32" },
        "endL1L2BridgeRollingHashMessageNumber": { "$ref": "#/$defs/uint" },
        "dynamicChainConfigHash": { "$ref": "#/$defs/hash32" },
        "parentFtxRollingHash": { "$ref": "#/$defs/hash32" },
        "parentFtxNumber": { "$ref": "#/$defs/uint" },
        "endFtxRollingHash": { "$ref": "#/$defs/hash32" },
        "endProcessedFtxNumber": { "$ref": "#/$defs/uint" },
        "parentDataRollingHash": { "$ref": "#/$defs/hash32" },
        "endDataRollingHash": { "$ref": "#/$defs/hash32" },
        "parentBlockHash": { "$ref": "#/$defs/hash32" },
        "endBlockHash": { "$ref": "#/$defs/hash32" },
        "parentDataTailTakeBytes": {
          "description": "0 at a chunk boundary; positive N takes the final N bytes of the actual unpacked first blob payload, requiring N < its length (§3.1).",
          "$ref": "#/$defs/tailCount"
        },
        "finalDataTailDiscardBytes": {
          "description": "Guest-derived unconsumed suffix byte count of the last blob payload: 0 at a fully consumed chunk boundary; positive N requires N < the actual unpacked last blob payload length (§3.1).",
          "$ref": "#/$defs/tailCount"
        },
        "l2L1Messages": { "type": "array", "items": { "$ref": "#/$defs/hash32" } },
        "filteredAddresses": {
          "description": "Distinct, sorted ascending by byte value: the canonical encoding of the set of addresses named by forced transactions refused in this range (order carries no meaning).",
          "type": "array",
          "uniqueItems": true,
          "items": { "$ref": "#/$defs/address" }
        },
        "programVks": {
          "description": "Distinct, sorted ascending by byte value: the canonical encoding of the set of guest program VKs verified beneath this proof (order carries no meaning).",
          "type": "array",
          "uniqueItems": true,
          "items": { "$ref": "#/$defs/hash32" }
        },
        "l2MessagingBlocksOffsets": { "type": "array", "items": { "type": "integer", "minimum": 1, "maximum": 65535 } },
        "blockCount": { "$ref": "#/$defs/uint" }
      }
    },
    "rollupProof": {
      "type": "object",
      "additionalProperties": false,
      "required": [
        "proof",
        "startBlockNumber",
        "publicInputs",
        "programVk"
      ],
      "properties": {
        "proof": { "$ref": "#/$defs/hex" },
        "startBlockNumber": { "$ref": "#/$defs/uint" },
        "publicInputs": { "$ref": "#/$defs/rollupPublicInputs" },
        "programVk": { "$ref": "#/$defs/hash32" }
      }
    }
  }
}
