{
  "guestProgramId": "0x3333333333333333333333333333333333333333333333333333333333333333",
  "provingSystem": "arithmetization-v1/prover-ray-v1",
  "metadata": {
    "startBlockNumber": 10,
    "endBlockNumber": 18,
    "startBlockTimestamp": 1763000000,
    "endBlockTimestamp": 1763000557,
    "transactionsCount": 9
  },
  "proofRequest": {
    "rollupProofs": [
      {
        "proof": "0xabcdef",
        "startBlockNumber": 10,
        "publicInputs": {
          "endBlockNumber": 11,
          "endBlockTimestamp": 1763000457,
          "endL1L2BridgeRollingHash": "0x3333333333333333333333333333333333333333333333333333333333333333",
          "endL1L2BridgeRollingHashMessageNumber": 7,
          "dynamicChainConfigHash": "0xc0c0c0c0c0c0c0c0c0c0c0c0c0c0c0c0c0c0c0c0c0c0c0c0c0c0c0c0c0c0c0c0",
          "parentFtxRollingHash": "0x4444444444444444444444444444444444444444444444444444444444444444",
          "parentFtxNumber": 15,
          "endFtxRollingHash": "0x5555555555555555555555555555555555555555555555555555555555555555",
          "endProcessedFtxNumber": 18,
          "parentDataRollingHash": "0x4747474747474747474747474747474747474747474747474747474747474747",
          "endDataRollingHash": "0x8d8d8d8d8d8d8d8d8d8d8d8d8d8d8d8d8d8d8d8d8d8d8d8d8d8d8d8d8d8d8d8d",
          "parentBlockHash": "0x0a0a0a0a0a0a0a0a0a0a0a0a0a0a0a0a0a0a0a0a0a0a0a0a0a0a0a0a0a0a0a0a",
          "endBlockHash": "0x0b0b0b0b0b0b0b0b0b0b0b0b0b0b0b0b0b0b0b0b0b0b0b0b0b0b0b0b0b0b0b0b",
          "parentDataTailTakeBytes": 0,
          "finalDataTailDiscardBytes": 0,
          "filteredAddresses": [
            "0x0101010101010101010101010101010101010101"
          ],
          "programVks": [
            "0xaaaaaaaaaaaaaaaaaaaaaaaaaaaaaaaaaaaaaaaaaaaaaaaaaaaaaaaaaaaaaaaa"
          ],
          "blockCount": 2,
          "l2MessagingBlocksOffsets": [],
          "l2L1Messages": [
            "0x7777777777777777777777777777777777777777777777777777777777777777",
            "0x8888888888888888888888888888888888888888888888888888888888888888"
          ]
        },
        "programVk": "0xbbbbbbbbbbbbbbbbbbbbbbbbbbbbbbbbbbbbbbbbbbbbbbbbbbbbbbbbbbbbbbbb"
      },
      {
        "proof": "0xabcdff",
        "startBlockNumber": 12,
        "publicInputs": {
          "endBlockNumber": 18,
          "endBlockTimestamp": 1763000557,
          "endL1L2BridgeRollingHash": "0x0000000000000000000000000000000000000000000000000000000000000000",
          "endL1L2BridgeRollingHashMessageNumber": 0,
          "dynamicChainConfigHash": "0xc0c0c0c0c0c0c0c0c0c0c0c0c0c0c0c0c0c0c0c0c0c0c0c0c0c0c0c0c0c0c0c0",
          "parentFtxRollingHash": "0x5555555555555555555555555555555555555555555555555555555555555555",
          "parentFtxNumber": 18,
          "endFtxRollingHash": "0x5555555555555555555555555555555555555555555555555555555555555555",
          "endProcessedFtxNumber": 18,
          "parentDataRollingHash": "0x8d8d8d8d8d8d8d8d8d8d8d8d8d8d8d8d8d8d8d8d8d8d8d8d8d8d8d8d8d8d8d8d",
          "endDataRollingHash": "0x8d8d8d8d8d8d8d8d8d8d8d8d8d8d8d8d8d8d8d8d8d8d8d8d8d8d8d8d8d8d8d8d",
          "parentBlockHash": "0x0b0b0b0b0b0b0b0b0b0b0b0b0b0b0b0b0b0b0b0b0b0b0b0b0b0b0b0b0b0b0b0b",
          "endBlockHash": "0x0b0b0b0b0b0b0b0b0b0b0b0b0b0b0b0b0b0b0b0b0b0b0b0b0b0b0b0b0b0b0b0b",
          "parentDataTailTakeBytes": 0,
          "finalDataTailDiscardBytes": 0,
          "filteredAddresses": [
            "0x0101010101010101010101010101010101010101"
          ],
          "programVks": [
            "0xaaaaaaaaaaaaaaaaaaaaaaaaaaaaaaaaaaaaaaaaaaaaaaaaaaaaaaaaaaaaaaaa"
          ],
          "blockCount": 7,
          "l2MessagingBlocksOffsets": [],
          "l2L1Messages": [
            "0x7777777777777777777777777777777777777777777777777777777777777777",
            "0x8888888888888888888888888888888888888888888888888888888888888888"
          ]
        },
        "programVk": "0xbbbbbbbbbbbbbbbbbbbbbbbbbbbbbbbbbbbbbbbbbbbbbbbbbbbbbbbbbbbbbbbb"
      }
    ]
  }
}
